<?xml version="1.0" encoding="UTF-8"?>
<dataroot xmlns:od="urn:schemas-microsoft-com:officedata" xmlns:xsi="http://www.w3.org/2001/XMLSchema-instance"  xsi:noNamespaceSchemaLocation="Tlabmemberdata.xsd" generated="2020-01-12T15:44:05">
<Tlabmemberdata>
<ID>1</ID>
<Nam>Theo Portlock</Nam>
<Start_x0020_Date>2016-10-01T00:00:00</Start_x0020_Date>
</Tlabmemberdata>
<Tlabmemberdata>
<ID>2</ID>
<Nam>Ben Dorgan</Nam>
<Start_x0020_Date>2017-03-01T00:00:00</Start_x0020_Date>
</Tlabmemberdata>
<Tlabmemberdata>
<ID>3</ID>
<Nam>Paula Corsini</Nam>
<Start_x0020_Date>2012-01-01T00:00:00</Start_x0020_Date>
</Tlabmemberdata>
</dataroot>
